Job Title,Profile
Medical Director,"MD background with 3-5 years industry experience. Experience as a responsible Medical Officer for clinical trial(s) is required. Training in Oncology is strongly preferred, and/or a scientific background, and/or deep understanding of solid tumor oncology is strongly preferred. Ability to represent the company in a variety of internal and external settings.
About You
You are passionate about our purpose and genuinely care about our mission to transform the lives of patients through innovative cancer treatment You bring rigor and excellence to all that you do. You are a fierce believer in our rooted-in-science approach to problem-solving You are a generous collaborator who can work in teams with diverse backgrounds You are determined to do and be your best and take pride in enabling the best work of others on the team You are not afraid to grapple with the unknown and be innovative You have experience working in a fast-growing, dynamic company (or a strong desire to) You work hard and are not afraid to have a little fun while you do so"
R&D CMC Officer,"Experience, skills and qualifications required:
BSc Degree in Chemistry, Biology or relevant field. 1+ years of experience in CMC within a Pharmaceutical organization. Scientific/technical writing skills Fluent in English and good MS Office skills Strong organization skills, multi-tasking and able to meet deadlines Effective communication and relationship management Knowledge of GMP and CMC guidelines Ability to work under pressure, resilience"
Quality Assurance Senior Officer - Biotechnology,"Bachelor Degree in Biology, Biotechnology, Chemical Engineering, or relevant field. MSc in any of these fields will be a competitive advantage Professional experience of more than 3 years in QA sector in Pharmaceutical and/or Biotechnology industry is required. Experience with pharmaceutical Quality Systems including change control, deviation and CAPA Prior experience with SAP, Trackwise and LIMS is a plus Fluency in English, oral and written Ability to build effective relationships with internal customers and supporting functions such as QC, QA, Engineering and Operations Resilience & ability to articulate complex information concisely"
Quality Assurance Officer,"Bachelor's degree in chemistry or related Professional whose career is related to pharmacy A minimum of 2 years’ experience in GxP (e.g. GMP, GDP) GDP knowledge of pharmaceutical products, medical devices and narcotic/psychotropic products, cosmetics, biocides, foods, etc. Proficient in establishing and maintaining a GDP/GMP Quality Management System Trained auditor for GDP/GMP (or at least acting as co-auditor). Experience in a QA role, particularly in managing pharmaceutical Quality Systems. Managing outsourced activities and third-party service providers Hosting of GxP inspections Working in an international setting Working with narcotic/psychotropic products
Knowledge and Skills
Desirable - Knowledge in national and international pharmaceutical legislation. Proactive, pragmatic, independent, organized and self-confident. Customer focused and cross-functional thinking and behavior. Works collaboratively maintaining good working relationships with cross functional teams and partners actively participating contributing to team success. Proficient in the use of Microsoft Office applications Competent in use of databases (preferred) Experience of Supplier Management (preferred) Fluent in spoken and written English. Regional language (German) preferred."
Medical Science Liaison,"High scientific or medical degree, PhD or Medical Doctor (GMC-registered) is required At least 2 years of experience as an MSL or in a very similar role in the UK Experience in Oncology is a must Deep knowledge and expertise of the NHS system in the UK is a must Previous experience of working in medical devices or pharmaceutical/biotech industry is required Demonstrated fluency in articulating scientific concepts and data A strategic, passionate, self-starter who takes the initiative Work well in large and small teams, ability to work remotely Ability to travel 80-85% of time Comfortable with occasional after-hours and weekends availability HCPs focus-oriented: bring expertise and innovation and collaborate with HCPs"
"Analytical Chemist (ICP-OES, ICP-MS, or AAS)","MSc in Life Sciences: Chemistry, Pharmacy, Biotechnology, or related fields. Minimum 2 years of experience in laboratory work. Practical knowledge of techniques used for the determination of metals such as ICP-OES, ICP-MS, and AAS. Experience in working with HPLC liquid chromatography techniques will be advantageous. Fluency in English. Practical skills in method development and validation will be an asset. Desire to learn and enhance skill set. Effective communication skills along with strong organizational and time management abilities are necessary"
"Sr Scientific Advisor, eCOA","As a member of a team of accomplished scientists, clinicians, and data analysts, the Senior Scientific Advisor provides scientific leadership and expert analysis to the Sales, Marketing and Client Services functions in a software company that creates electronic data collection systems for clinical trials. Senior Science Advisors support and drive the sales and delivery of Clario services and enterprise attachments (e.g., eCOA, Cardiac & respiratory safety, AVClario, Insights Cloud).
Sales support:
Review protocol from prospective customers & respond rapidly to meet client timelines Plan the data collection design based on best practices, knowledge of literature, compliance, patient/site preference and applicable regulations Determine the complexity of the project Provide scientific support and content development for capability and bid defense presentations Attend pre-sales customer presentations and present relevant science content
Client Services support:
Assisting project handoff from sales to services Contribute to training of Client Services staff regarding diary design, scientific objectives of proposals, best practices, etc. Support Client Services at selected post sales customer meetings
Marketing support:
Contribute to product development decisions for eCOA and science services Participate in presentations at professional forums, conferences & meetings Lead the preparation and review of publications, abstracts & white papers Design and lead scientific projects which are designed to obtain marketing information Acquire and maintain critical knowledge to support sales and Clario project teams Maintain knowledge base regarding regulations or scientific advances that influence Clario’s eCOA services to customers, including regulatory guidances, scientific literature, and best practices based on data analysis and/or internal research efforts Participate in discussions on behalf of the client with scientists such as questionnaire copyright holders, to facilitate Clario’s deliverables to clients Direct and lead discussions with other industry scientists to facilitate Clario’s deliverables to clients Design research studies and develop internal research pipeline and external outreach including webinars, abstracts, papers, white papers and related content
What we look for
PhD preferably with clinical trial experience & multiple years of experience in clinical trial technology or related industry (Minimum 3-5+ years relevant experience). Master’s degree acceptable for highly skilled candidates with exceptional qualifications Significant experience in conduct of clinical trials & knowledge of drug development cycle Experience in the clinical trial technology product life cycle and Clario enterprise technologies and services Business driven and business growth savvy Polished presenter with considerable experience in pre and post-sales environments with clinical trial technology Comfortable and fearless learning new roles, versatile, fast learner Team leader & team player Highly interactive across the enterprise, comfortable with technology platform and science bridging Clario technology and services to the clinical trial needs of our clients Highly skilled in the sales and delivery of science services including advanced training, clinical data surveillance and/or consulting services Excellent interpersonal and communication skills; Ability to understand and communicate with representatives from the range of disciplines within biopharmaceutical development Ability to manage multiple priorities and projects, and balance workload and timelines; Able to work in a fast-paced and dynamic environment

PhD preferably with clinical trial experience & multiple years of experience in clinical trial technology or related industry (Minimum 3-5+ years relevant experience). Master’s degree acceptable for highly skilled candidates with exceptional qualifications Significant experience in conduct of clinical trials & knowledge of drug development cycle Experience in the clinical trial technology product life cycle and Clario enterprise technologies and services Business driven and business growth savvy Polished presenter with considerable experience in pre and post-sales environments with clinical trial technology Comfortable and fearless learning new roles, versatile, fast learner Team leader & team player Highly interactive across the enterprise, comfortable with technology platform and science bridging Clario technology and services to the clinical trial needs of our clients Highly skilled in the sales and delivery of science services including advanced training, clinical data surveillance and/or consulting services Excellent interpersonal and communication skills; Ability to understand and communicate with representatives from the range of disciplines within biopharmaceutical development Ability to manage multiple priorities and projects, and balance workload and timelines; Able to work in a fast-paced and dynamic environment"
Sr. Director RA Early Development Lead,"Minimum 15 years of regulatory affairs experience within biopharmaceutical organizations, of which at least 5-7 years must have been in global leadership roles with experience of early development regulatory strategies and submissions PhD or PharmD preferred Prior experience working in rapidly growing pharmaceutical organizations is desirable A thorough understanding and experience with the development and licensure of biologic drugs for orphan and pediatric indications along with knowledge of and monitoring of the evolving landscape of regulations and guidelines A strong scientific background and ability to interact with scientists and clinicians Ability to speak and interact with a diverse group of individuals on technical and business topics Familiarity with current and emerging regulatory legislation, industry trends, and health care business practices globally Create a culture of collaboration, excellence and innovation which inspires team members to be trailblazers and perform at their highest abilities, optimizing their effectiveness to enable the timely and quality creation of local submissions A clear communicator who can influence stakeholders effectively, both internally and externally, with outstanding presentation, written and verbal communication skills Track record of successful interactions with regulatory and health authorities You are a connector, building relationships and partnering across the organization to achieve the company goals You excel in a fast-paced, results-driven, highly accountable environment You are pragmatic, yet creative and innovative and lead while ""rolling up your sleeves"" to get it done You show strong leadership with proven ability to build, motivate and develop a team You resonate with the values of argenx and you are ready to drive the Company Culture You combine strategic thinking with the ability to execute, both individually and by leading teams to achieve operational excellence in the face of challenging goal"
Senior Formulation and Analytical Scientist,"PhD, MSc or Degree in Pharmacy, Pharmaceutical Science, Chemistry, Chemical Engineering or related subject. Developed and possesses an in-depth understanding of the science and technology of pharmaceutical dosage forms, and associated characterisation techniques and apply this knowledge to development a required early stage formulation. Experience in Pre-clinical formulation development and/or manufacturing (non-GLP and GLP) is desirable but not essential. Familiarity with UPLC/HPLC, XRPD, DSC, TGA, GVS, PSD instrumentation. Proficient in report writing and reviewing. Proven expertise in formulation development as evidenced through sustained high performance in a number of previous projects. Proven ability to solve problems on assigned projects. Able to take appropriate day to day technical decisions regarding formulation development. Excellent organisational and communication skills and demonstrated an ability to work collaboratively and effectively in multidisciplinary teams in a fast-paced environment. Self-motivated, independent, enthusiastic, open minded view and problem solving skills."
QA (Senior) CQV Specialist,"Review and approve: User Requirement Specifications (URS), qualification and validation plans, validation documentation (DQ, IQ, OQ, PQ) and risk assessments related to for equipment, facilities, and utilities Coordinate commissioning protocols and reports Review and approve FAT/SAT documentation and Validation Life Cycle Documentation Ensure accurate application of validation quality systems and develop improvement plans Conduct periodic reviews of validated GxP equipment, facilities, and utilities Quality oversight on validation impact assessments prior to changes on equipment, facilities, or utilities Provide support for quality-related issues, including GMP regulations and internal SOP compliance Assist production and technical service teams with validation activities Manage validation deviations and CAPA processes Contribute to continuous improvement and international standardization
What you will bring:
Bachelor's degree in a scientific or technical field (minimum) Minimum 1-3 year of experience in validation activities within a pharmaceutical or biotech manufacturing environment Quality assurance experience with a focus on technical installations (facility/utility) Expertise in HVAC, autoclave, VHP, purified water, and process gases Experience with laboratory systems in a pharma environment Understanding of regulatory requirements and industry standards (FDA, EMA, ICH, etc.) No company visa sponsorship available for this role

Bachelor's degree in a scientific or technical field (minimum) Minimum 1-3 year of experience in validation activities within a pharmaceutical or biotech manufacturing environment Quality assurance experience with a focus on technical installations (facility/utility) Expertise in HVAC, autoclave, VHP, purified water, and process gases Experience with laboratory systems in a pharma environment Understanding of regulatory requirements and industry standards (FDA, EMA, ICH, etc.) No company visa sponsorship available for this role"
Process & Formulation Scientist,"Education: Master’s degree (or equivalent industry experience) in Pharmacy, Chemistry, Chemical Engineering, or a related field. Experience: 3-5 years in formulation development within the pharmaceutical or medical device industry. Technical Skills: Strong understanding of formulation science principles and product development processes. Regulatory Knowledge: Familiarity with medical device standards and regulatory requirements. Analytical & Problem-Solving: Skilled in data analysis, experiment design, and result interpretation. Communication: Strong written and verbal communication skills for collaboration and regulatory documentation. Project Management: Ability to manage multiple projects and meet deadlines efficiently. Languages: Fluent in English; Dutch is preferred."
"Country Medical Lead, Cell Therapy","The ideal candidate for this position will have the following qualifications:
Education
Advanced degree: MD, PharmD
Knowledge and Experience
Extensive expertise & experience in haematology/oncology is required, in lymphoma/myeloma and cell therapy is preferred Previous industry and medical affairs experience in haematology/oncology is required, preferably in haematology and in Cell Therapy Ideally current & existing partnership with the main opinion leaders in lymphoma and myeloma in Germany Experience in people leadership/management of staff is required Experience in the management of or involvement in clinical trials is highly desirable
Personal skills
Ability to adapt in a constantly evolving environment Self-motivated with a strong sense of ownership in areas of responsibility Excellent verbal and written communication skills as well as interpersonal skills are required Must be fully cognizant of all relevant scientific data and regulatory requirements for field-based personnel Must be committed to continuing education to maintain knowledge base Seeks for advice and collaboration within and outside Kite Must have the ability to work as a member of several teams that may overlap such as national MS team, regional sales team, national accounts, and others Enjoys working in a fast pace entrepreneurial environment Strong appetite for cross functional and team work Proven ability to lead, develop and empower teams in changing environments"
Strategist/Director Regulatory Affairs CMC,"Master Degree in Life Science, PhD preferred Minimum of 8 years of experience in the pharmaceutical industry Minimum of 5 years of experience in global regulatory affairs CMC with emphasis on late-stage CMC drug development and marketing authorization applications; experience in the development of biologics preferred Scientific know-how pharmaceutical development, manufacturing, and control of drug substances and drug products of biological products In depth knowledge in global Regulatory Affairs CMC (RACMC) of biological products Experience in working in global pharma industry Experience in working in global interdisciplinary teams
Personal skills:
Proven ability to plan, coordinate and lead activities simultaneously on multiple projects Strong IT/Digital skills Strong project management skills High level of analytical thinking Excellent personal and intercultural skills paired with the ability to work cross functionally in a multinational organization Solution and detail-oriented; well organized and self-motivated Excellent written and oral communication skills in English, German as a second language preferred Open-minded, showing accountability Ideally proven leadership skills in an intercultural team environment Strong working knowledge of Microsoft Office"
"Senior QA Specialist, Material & Supplier","Educational Background: Bachelor’s degree in a relevant discipline, preferably in life sciences. Experience: 1-3 years of experience in a quality assurance or compliance role, especially within a pharmaceutical or medical device environment. Technical Skills: Familiarity with ERP systems like SAP and MS Office software. Experience with Quality Management Systems (e.g. TrackWise and LIMS) and documentation management processes (DMS) is a benefit. Attention to Detail: Strong attention to detail and excellent organizational skills. Communication & Teamwork: Effective communication and teamwork abilities, coupled with a willingness to learn and adapt within the quality and compliance landscape."
Pre-clinical Manufacturing Senior Scientist,"Degree in Chemistry, Biochemistry, Pharmaceutical Sciences or equivalent experience as lab technician or pharmaceutical technologist Experience as a research/technical assistant in the pharmaceutical or chemical industry (preferred in an aseptic environment related to parenteral or biological manufacturing or development) Experiences with High potent molecules and with qualification of new equipment is an asset Good documentation skills in creating Batch manufacturing documentation"
Senior Associate Ecotoxicologist (Pharmaceutical/Biocide/Reach),"BSc and/PhD preferably in Environmental Toxicology/Ecotoxicology or Toxicology. You will need to display excellent communication skills in both verbal and written forms, good interpersonal skills. You enjoy sharing your knowledge to improve results, and are also comfortable having more difficult conversations, when required. Experience with environmental risk assessments, data interpretation for consumer products, and use of consumer modelling tools, e.g. OECD, QSAR is preferable. Working knowledge of global safety-relevant regulations. Experience of Environmental Fate (not essential). Experience in monitoring ecotoxicological studies is highly desirable. Excellent verbal and written communication skills. Results-oriented, ability to work in an agile environment, critical thinker and self-motivating. Experience in working in multi-functional and multi-cultural teams."
Medical Science Liaison,"Advanced degree in a medical or scientific field (MD, PharmD, PhD, or equivalent). Minimum of 3 years of experience as an MSL, preferably in CNS therapeutic area. Strong understanding of clinical research methodologies and drug development processes. Excellent communication and presentation skills, with the ability to convey complex scientific information to various audiences. Proven ability to build and maintain relationships with KOLs and other healthcare stakeholders. Thorough understanding of compliance regulations and the ability to work within ethical guidelines. Strong analytical and problem-solving skills. Ability to work independently and as part of a high-performance team. Willingness to travel up to 50-75% of the time."
Biomarker Scientist,"PhD in Immunology or Molecular Biology with at least 3 years of relevant research/industry experience, or Master degree with extensive industry experience in analyzing human samples and/or monitoring analysis of biomarkers during clinical trials; Pharma/Biotech experience in the development & implementation of biomarker strategies and methods to support drug development; Direct experience with the characterization of biomarkers using ligand binding assays; Understanding of concepts such as COU and and fit-for-purpose biomarker assay validation and how to apply these; Experience in implementing biomarker assays (development and validation) in clinical studies and analyzing corresponding data; Experience in managing outsourced activities at external vendors; Understanding of GCP/GCLP guidelines and current global regulations.
Profile
Team player, motivated, enthusiastic, accurate in execution and reporting; Strong project, organization, and interpersonal skills; Good communication skills and good written and oral English language skills; Resilience with the ability to adapt to changes in priorities and to work effectively on multiple programs in a fast-paced environment; Team-player, capable to collaborate effectively with internal and external stakeholders.

Team player, motivated, enthusiastic, accurate in execution and reporting; Strong project, organization, and interpersonal skills; Good communication skills and good written and oral English language skills; Resilience with the ability to adapt to changes in priorities and to work effectively on multiple programs in a fast-paced environment; Team-player, capable to collaborate effectively with internal and external stakeholders."
Project Leader - Biopharmaceutical Quality Control Ibex Solutions,"MSc or PhD in the Life Sciences (Biology, Biochemistry or Pharmaceutical Sciences); Experience in the GMP environment and in quality control is a Plus; Proficient use of common software applications (MS Office) is required. Knowledge of individual pharmaceutical/laboratory software (e.g. Documentum, LIMS, Trackwise) is an advantage; You enjoy working with many people in many different business areas and you bring the necessary organizational and project management skills to handle demanding projects. Your communication style is characterizes by professionalism and assertiveness; Excellent communication skills in English is a must, communication skills in German is an advantage."
Lead Product Development Scientist,"Are you….
Educated to PhD Level in - Pharmacy, Chemistry or closely related subject.
Do you have?
Experience in statistical experimental design and statistical interpretation of data; Sound knowledge of chemistry; Excellent organizational, problem-solving, communication skills; High levels of motivation with the ability to work largely unsupervised; Proven ability to maintain high standards of work, attention to detail and right first time approach; Demonstrable team work and interpersonal skills; Have a flexible approach to changing priorities and be able to adjust working hours as necessary."
Associate Clinical Development Specialist,"Bachelor/Master's degree, related to healthcare; At least two years of relevant work experience within healthcare and/or in a similar type of role; Excellent English, both written and spoken; Strong analytical skills, interpersonal skills, and commitment to continuous learning and self-improvement; Availability to travel frequently (~30%), including occasional evenings and weekends.
The following qualifications are desirable, but not mandatory:
Knowledge of colorectal, general, bariatric, urologic, and/or gynecologic surgery and products; Knowledge of European healthcare systems and dynamics; Leadership experience; Knowledge of French, German and/or Italian language."
