Job Title,Profile
"Sr. Specialist, Regulatory Operations","Bachelor’s degree in a scientific discipline or systems technology or equivalent. 3-5 years of pharmaceutical experience working in a regulated, life science environment (pharmaceutical, biotechnology, consumer health). Working knowledge of eCTD publishing systems, EDMS technology, and related publishing tools (Veeva RIM). Working knowledge of European, EEA, Western Europe, US, and ROW electronic submission standards and industry trends for electronic submission requirements. Knowledge of SPOR, and IDMP requirements. A demonstrated ability to collaborate with groups cross-functionally (Regulatory, clinical, nonclinical, etc.). Strong attention to detail and ability to work in a fast-paced environment. Excellent document formatting/troubleshooting skills in MS Word/PDF Professional. Excellent English Language Skills."
Process Expert Drug Product,"Bachelor/Master Degree or relevant experience preferred; Preferred area of study: Pharmaceutical Technology, Chemistry, Pharmacy or equivalent scientific degree; Min of 1 year of experience in Sterile Manufacturing on the shopfloor and/or QC/QA; Familiarity with GMP requirements, quality procedures and SOP execution; Good communication skills and interaction with a variety of interfaces within the organization and within the shopfloor; Structured, focused, proactive and well-organized working attitude; Focused on collaboration and motivation; guided by scientific principles; Prepared to work flexible working hours; Proficient in English, German is an advantage."
"Senior Research Associate, Clinical Biomarker Laboratory, Immunoassays","BSC/MSc Degree in Biology, Biotechnology or biomedical scientists with laboratory research experience in a lab environment Hands-on experience with cell culture in aseptic conditions. 2-3 years technical experience in cell culture, lab instrumentation, cell-based assays preferred. Demonstrated level of independence and work ethics. Good written, presentation and interpersonal communication skills. Good computational skills, preferably experienced with Word, Excel, Power Point, GraphPad Prism. Preferably knowledge of working in a regulated environment (GCP, GLP, ISO standards). Preferable experience with LIMS systems."
"Senior Director, New Product Strategy & Innovation","Education/Certifications:
Advanced degree (PhD, MD, or MS) in Life Sciences-related discipline and/or an MBA Fluency in spoken and written English, knowledge of additional languages such as French would be helpful.
Experience:
A minimum of 7 - 10 years’ experience in Global Marketing or Global Portfolio Management roles within the biopharmaceutical industry, including experience in early commercial planning, disease area strategy, business development activity, and forecasting Strategy consulting experience in life sciences (including work in early-commercial strategy, commercialization, LCM, BD, due diligence, etc.) is highly valued Experience developing cross-functional pre-commercialization plans within pharmaceutical company or management consulting Experience in working across a cross-functional matrix team to meet deliverables on time and budget Strong scientific, medical, and commercial experience in oncology, neuroscience and/or rare diseases with a proven knowledge of clinical pipeline planning, business development, and launch activities Competitive landscaping experience
KEY TECHNICAL COMPETENCIES
Deep strategic marketing expertise (including positioning, targeting, segmentation, launch planning, life cycle management) Strong business acumen and understanding of global markets Excellent analytical skills and strategic thinking, including forecasting and business case development Strong communication and presentation skills Sense of urgency and experience in delivering parallel workstreams efficiently Qualitative & quantitative market research experience Strong planning and project management skills"
QA Lead,"Build internal and external working relationships to allow management of Complaint cases. Quality Com Ops, Joint Assessment Forum, Quality Safety Evaluation Board, Global Patient Safety Team, Medical Information Team, All Complaint Managers, MHRA, FDA. Communicate complaint data, trends and improvement activities within the local and global Ipsen community. Support the investigation into product complaints and the development of CAPA to reduce the risk of recurrence. Provide expert quality input/solutions based on knowledge of GMP, QRM and relevant manufacturing processes to Ipsen affiliates, partners, and regulatory agencies & Health Authorities.
What we are looking for…
Bachelor's degree is the minimum requirement.. Extensive experience in Pharmaceutical Quality. Prior work history of complaint management, quality compliance and of packing technology. Knowledge of Global Regulations in relation to Product Security. Capable of communicating effectively with internal and external partners, health authorities, and representing Ipsen at industry events. Able to provide training to cross functional teams on Complaints and product security topics. KPI management.

Bachelor's degree is the minimum requirement.. Extensive experience in Pharmaceutical Quality. Prior work history of complaint management, quality compliance and of packing technology. Knowledge of Global Regulations in relation to Product Security. Capable of communicating effectively with internal and external partners, health authorities, and representing Ipsen at industry events. Able to provide training to cross functional teams on Complaints and product security topics. KPI management."
"Director, Regulatory Affairs","Ideal
Proven experience of drug development and managing complex worldwide products/projects within a relevant therapeutic area, in key geographies. Track record of building excellent relationships with regulatory authorities FDA.
Minimum
Advanced degree (or equivalent) in scientific discipline (not limited to Pharmacy, Medicine, Chemistry, Biological Sciences). Significant experience in the pharmaceutical industry, including minimum 10 years in Regulatory Affairs.
Key Technical Competencies Required
Excellent written and oral communication skills and delivers all communication with clarity and impact. Commands attention through a range of communication styles. Ability to distil key information from complex and extensive sources and present the information in a constructive way. Solid project management skills with proven ability to develop and implement longer term plans or delivery of large-scale projects. Consistent ability to foster strong matrix working. Proven track record of facilitating groups of individuals to work together on innovative regulatory solutions. Strong interpersonal and negotiation skills with a proven ability to build strong personal networks, both within and outside. Ipsen and use them to secure appropriate support and outcome for a project. Proven capability to influence decision makers both internally and externally. Strategic thinking with a proven ability to derive creative solutions to regulatory problems, while balancing the expectations of Agencies and ensuring compliance with regulation in all regions. Shows a constant focus on improving performance and excellence in all tasks. Challenges and questions ways of working to seek improved process. Capable of seeing opportunities and revising process or approach to reduce barriers for others to be able to deliver more. Proven ability to lead change and communicate difficult messages effectively."
Electrophysiologist - Senior Scientist,"Scientific University’s Degree or PhD. 3/5+ years of experience in academia and/or pharmaceutical industry to work within a heterogeneous and interactive electrophysiology group. Experience in preparation and recording from native tissue and cells. Experience in brain slices recording, in particular from locus coeruleus and tuberomammillary neurons, as well as from brainstem slices, will be an added value. Good written and verbal communication skills are required. Project teams at Evotec are interdisciplinary and require strong team players with effective communication and strong flexibility. Significant components of the role include technical leadership/ownership."
Sr Director - Manufacturing Operations,"Bachelor’s degree in biological or engineering science; 15+ years relevant experience.
Qualification Requirements:
Technical mastery of cell culture, purification, and solution preparation operations using disposable-based manufacturing technologies; Proven knowledge of cGMP requirements to ensure compliance; Previous experience managing the activities of both individuals and large groups of staff; In-depth knowledge of equipment, operations, and engineering principles; Candidate must possess strong focus on quality and attention to detail; Possess effective task/time management organizational skills; Motivated, self-starter with strong mechanical aptitude; Good interpersonal, team, and communication skills are a must; Excellent oral and written communication skills.
Additional Preferred Qualifications:
Strong understanding of process automation (e.g. DeltaV) and BAS systems; Commissioning and validation experience, including risk assessments, user requirement specifications, execution of DQ, IQ, OQ, and PQ activities, and validation summary reports; Applies knowledge and expertise to solve complex technical problems; Significant contributor to multi-disciplinary teams at the functional level; Mentors and provides technical advice to individuals within the team; Thorough working knowledge of US FDA CFRs and European EMA, including ICH regulations.

Technical mastery of cell culture, purification, and solution preparation operations using disposable-based manufacturing technologies; Proven knowledge of cGMP requirements to ensure compliance; Previous experience managing the activities of both individuals and large groups of staff; In-depth knowledge of equipment, operations, and engineering principles; Candidate must possess strong focus on quality and attention to detail; Possess effective task/time management organizational skills; Motivated, self-starter with strong mechanical aptitude; Good interpersonal, team, and communication skills are a must; Excellent oral and written communication skills.
Additional Preferred Qualifications:
Strong understanding of process automation (e.g. DeltaV) and BAS systems; Commissioning and validation experience, including risk assessments, user requirement specifications, execution of DQ, IQ, OQ, and PQ activities, and validation summary reports; Applies knowledge and expertise to solve complex technical problems; Significant contributor to multi-disciplinary teams at the functional level; Mentors and provides technical advice to individuals within the team; Thorough working knowledge of US FDA CFRs and European EMA, including ICH regulations."
Clinical Statistician - Research & Development,"M.S., Ph.D. Statistics, Biostatistics
Other Information/Additional Preferences:
Proficient in statistical programming languages/software such as SAS, R, Spotfire, WinBUGs, etc. Interpersonal communication skills for effective customer consultation. Teamwork and leadership skills. Technical expertise and application with working knowledge of experimental design and statistical analysis. Self-management skills with a focus on results for timely and accurate completion of competing deliverables. Resource management skills. Creativity and innovation. Demonstrated problem solving ability and critical thinking. Business process expertise associated with critical activities (e.g., regulatory submissions)."
Principal Statistical Programmer RWE EU,"Successful candidates will be able to meet the qualifications below with or without a reasonable accommodation. MS in Statistics/Biostatistics or Pharmaco-epidemiology. 4 years (MA) – 7 years (BA) relevant experience in the pharmaceutical industryExcellent understanding of statistical methodologies, real-world data, and observational studies. Experience on SQL and statistical software (e.g., SAS, R, Python) and secondary data sources including registries, EMR and claims is an advantage. Excellent oral and written communication skills. Excellent Project planning skills. Excellent collaborating skills. Oncology experience preferred."
CMC Lead Biologics,"University degree (preferably Ph.D.) in chemistry, biochemistry, pharmaceutics, or related disciplines within pharmaceutical/biotechnology sciences. At least 4+ years of experience in the pharmaceutical/biotechnology industry working in a drug development environment. Ph.D. (chemistry, biochemistry, pharmaceutics, engineering, or related disciplines) or master's degree with equivalent work experience to doctoral degree within pharmaceutical/biotechnology sciences. Basic knowledge about GMP requirements within (bio-)pharmaceutical production. Ability to prioritize and manage multiple activities and priorities simultaneously. Extensive experience in project management, process, product, and/or analytical development activities and pharmaceutical/oncology project development. Extensive knowledge of global CMC regulatory requirement and preferably BLA/MAA submission experiences for oncology area. Strong verbal and written communication skills in English. Ability to interface effectively with multi-national teams in a multi-cultural work environment."
R&D Director,"PhD in Polymer Chemistry, Organic Chemistry, Material Sciences or related field is required with min. 10 years of post-graduated experience; Experience in Polymer synthesis and Characterization is highly preferred; The ability to fluently read, write, understand and communicate in English; Prior experience working in medical device field and regulated laboratory setting per GLP/GDP requirements is preferred."
Head of Quality Excellence,"Proven track record of leadership in quality assurance and project management in pharma industry. Extensive experience driving organizational excellence initiatives, including the implementation of performance management frameworks, stakeholder management frameworks, and process optimization strategies. Strong analytical skills with the ability to interpret complex data sets and derive actionable insights to improve operational efficiency and customer experience. Exceptional communication, interpersonal, and influencing skills, with the ability to engage and align stakeholders at all levels of the organization. Strategic mindset with a results-oriented approach and the ability to thrive in a fast-paced, dynamic environment."
Senior Scientist - Cell and Molecular Biology,"Ph.D. with preferably 2+ years of experience; Prior industrial or relevant academic experience; Previous experience in the fields of molecular biology and/or cancer biology; Expertise in assay development in the area of Drug Discovery (biochemical, enzymatic, coupled, cell-based assays); Expertise in assay optimization and validation in GMP (e.g. for batch release testing); Technical expertise with mammalian cell culture (essential), standard molecular biology techniques like ELISA, Western Blot, and qPCR, as well as cytotoxicity, proliferation, apoptotic and cellular reporter system assays; Expertise with flow cytometry, cytokine release, cytotoxicity and proliferation assays is strongly preferred; Experience in working with cell lines and cell-based assays in microplate format (experience with 3D assays will be a plus); Expertise in working in a GxP environment is preferred; Practical experience with analysis software such as FlowJo, GraphPad Prism, and Excel is strongly preferred; Ability to manage large amounts of data and supervise less experienced scientists/research assistants; Willingness to learn and adopt new experimental techniques; Good knowledge of written and spoken English."
Senior Quality Specialist,"Educated to Degree level (life sciences) or equal experience. Previous experience within a Quality role. Previous experience within the pharmaceutical industry Detailed knowledge of EU Good Distribution Practice and MHRA/HPRA requirements. Experience of participating in both internal GxP audits and regulatory inspections. Knowledge and training within GxP. Experience and advanced knowledge of Microsoft Office. Excellent verbal, written, analytical, and interpersonal skills. Self-motivated, organised, and able to problem solve.
Preferred requirements:
Experience as a Responsible Person for Import (RPi). Quality Management System Lead Auditor or Pharmaceutical GMP Lead Auditor Qualification Membership of an acceptable professional body.

Experience as a Responsible Person for Import (RPi). Quality Management System Lead Auditor or Pharmaceutical GMP Lead Auditor Qualification Membership of an acceptable professional body."
"Scientist Quality Control, Bioanalytics","MSc in Biology, Biochemistry or a related field, or equivalent experience. Proven hands-on experience with ELISA is a must Experience with Biacore is a plus Experience with analytical method development is a plus Work experience in the pharmaceutical industry, particularly in a GMP environment is a plus. Willing to work on a temporary ca 8-9 months contract Proficiency in English is essential; German language skills are an advantage."
Manager Quality Assurance,"Minimum of 5 years pharmaceutical manufacturing site quality operations and leadership experience, including: Deep knowledge of cGMP requirements of local and major international authorities like EMA and US FDA for products and process, Deep knowledge on sterile dosage forms manufacturing and sterility assurance High level of understanding of manufacturing, packaging, ICH guidelines as well as CMC content of regulatory submissions, Knowledge of chemical/pharmaceutical production operations/ lifecycle, production equipment/ validation and relevant technologies and product types, Deep knowledge of Quality Systems Experience leading, inspiring and coaching teams Experience developing and implementing and continuously improve existing and new, efficient, and effective business processes Must have adequate practical knowledge of pharmaceuticals manufacturing and/ or control Must have practical knowledge of pharmaceutical cross functional operations (e.g., Supply Chain, Engineering, Production)
The candidate should be able to delegate, well organized, should be able to adapt and lead change."
Lead Analytical Scientist,"Are you….
Educated to Degree or Masters Level (PhD advantageous) in chemistry (or related subject) with strong’ industry experience (5 years plus),
Do you have?
Experience leading the development and validation of analytical methods for UPLC/HPLC and GC is essential. . An understanding of requirements for implementing a QbD approach to method validation and method lifecycle management. Experience delivering technical presentations. Knowledge of global regulatory and compliance requirements. Previous experience of writing/reviewing technical documents. Good planning and organising skills & adaptable to changing priorities. Strong communication and interpersonal skills with previous experience in cross-collaboration"
Quality Assurance Group Specialist,"University degree in Pharmacy or Natural Sciences (Biology, Biochemistry, Biotechnology) or equivalent, 1-2 years of experience in a GMP-regulated environment (laboratory, production, or quality-related roles), Familiarity with regulatory requirements and international collaboration is a plus, Strong analytical skills and attention to detail, Good English communication skills (written and spoken), Ability to manage multiple tasks and work effectively in a team, Enthusiastic, well-organized, and eager to learn and grow, Proficiency in Microsoft Office (Word, Excel, PowerPoint, databases)."
Junior/Senior Scientist - Organic/Medicinal Chemistry,"PhD or Master’s in chemistry Previous experience of independent work in the field of synthetic organic chemistry Experience in synthetic, purification, and spectroscopic techniques used in the preparation and characterization of complex organic molecules (HPLC, NMR instrumentation) Strong interest in synthetic organic chemistry and application of the latest scientific methodologies to solve challenging medicinal chemistry problems Familiarity with standard laboratory instrumentation and software (SciFinder, SpinWorks, Biovia Draw…) is an advantage Ability to function as a part of an interdisciplinary team in support of overall research activities and project goals Proven expertise in medicinal chemistry with the passion to contribute significantly to the discovery of novel therapeutic agents, as well as understanding of the entire drug discovery R&D process, including ADME/PK, pharmacology, formulations, and computational chemistry is an advantage"
Junior Scientist/Scientist - Pharmacologist,"To be successful in this role we are looking for individuals who can demonstrate the following:
Academic title of Doctor of Veterinary Medicine or Master of Sciences in biology area Previous experience in same or similar jobs is an advantage A passion for in vivo pharmacology and translational sciences Problem solving skills with interest in working in an exciting, fast-paced environment Ability to work independently as well as within a flexible team-oriented environment Excellent communication skills and MS Office proficiency"
Clinical Trial Manager,"Experience: A Bachelor’s or master’s in medical, biological, or pharmaceutical sciences (or equivalent). With 3-5+ years of experience in clinical trial management from a pharmaceutical company and/or CRO, ideally within oncology or first-in-human trials. Expertise: Strong knowledge of trial execution, GCP, and clinical drug development, with experience operating in a global setting. Skills: Exceptional communication skills (written and verbal), risk management abilities, and stakeholder management. Soft Skills: A proactive problem solver who identifies risks and develops effective mitigations. A collaborative leader with a quality mindset, adaptability in fast-paced environments, and the ability to inspire trust.
About You
You are passionate about our purpose and genuinely care about our mission to transform the lives of patients through innovative cancer treatment You bring rigor and excellence to all that you do. You are a fierce believer in our rooted-in-science approach to problem-solving You are a generous collaborator who can work in teams with diverse backgrounds You are determined to do and be your best and take pride in enabling the best work of others on the team You are not afraid to grapple with the unknown and be innovative You have experience working in a fast-growing, dynamic company (or a strong desire to) You work hard and are not afraid to have a little fun while you do so"
Senior Data Manager,"Degree in life science, pharmaceutical, biology or related field or at least 3 years’ experience in data management field or similar in a pharmaceutical environment or equivalent; Knowledge of Data Management processes, Good; Knowledge of pharmaceutical industry guidelines like ICH, GCP etc, Good; Knowledge of coding dictionaries like MedDRA and WHO-DD or equivalent, Good; Knowledge in one or more DM systems, Good.
TECHNICAL COMPETENCES & SOFT SKILLS
English, Good; MS Office Suite, Good; Professional; Trustworthy; Ability to effectively prioritize; Quality focused; Personable Attitude; Willingness to learn; Team Player; Effective Stress Management Techniques; Learning Agility; Ability to Manage Conflict; Problem Solving Skills; Effective Verbal Communication Skills; Commercial and Technical Writing Skills; Networking Skills."
Medical Science Liaison,"The ability to understand, process, communicate and present scientific information to a high standard; Good understanding of the clinical trials process and research infrastructure in the country in which the role is based; Possess excellent presentation and team working skills; Project management skills – to deliver on complex tasks within timeframe and manage milestones; IT skills, in particular competent with Microsoft Word, Excel and PowerPoint; Ability to work autonomously, in a field-based setting whilst contributing positively to the central Medical Affairs and Global Brand teams; External and Internal customer focus with strong networking capabilities and integration with Health Care Professionals to ensure opportunities for the local health service, Norgine and patients are maximised; The highest ethical standards, with a working knowledge of industry standards including the relevant Codes of Practice.
SKILLS & KNOWLEDGE
Advanced degree in a scientific or medical field; Minimum 2 years of experience as a Medical Science Liaison in the pharmaceutical industry is essential; Excellent communication and presentation skills; Ability to build and maintain strong relationships with healthcare professionals and key opinion leaders; Strong analytical and problem-solving skills; Ability to work effectively both independently and as part of a team; Willingness to travel as needed."
Bioprocess Engineer USP/DSP(Microbial)/BioConjugates,"Master's degree or equivalent experience in Biotechnology, Biochemical Engineering, Biochemistry, Process Engineering, or a related Life Science field (or a Bachelor's degree with relevant pharmaceutical production experience). Expertise in Upstream, Downstream processing, or Bio-conjugation technology. Experience in bio-manufacturing and/or scaling up a biopharmaceutical facility, with cGMP experience being an advantage. Excellent English communication skills; German proficiency is a plus. An organized and goal-oriented approach to work, with a willingness to consider new ideas, strong motivation, and a problem-solving approach."
