Job Title,Profile
Global Regulatory Lead,"Minimum 10 years of regulatory affairs experience within biopharmaceutical organizations, of which at least 5-7 years must have been in global leadership roles with a focus on major regulatory regions such as FDA, EMA, or PMDA; PhD or PharmD preferred; Prior experience working in rapidly growing pharmaceutical organizations is desirable; A thorough understanding of the drug development process with expertise in orphan drugs, along with knowledge of the developing landscape of regulations and guidelines, specifically in United States; Demonstrated ability to coordinate the development of critical regulatory documents involved in the approval of medicines with a focus on the FDA; Affinity with science and ability to interact with scientists and clinicians; Experience interacting with regulatory authorities, especially the FDA and EMA; Ability to speak and interact with a diverse group of individuals on technical and business topics; Familiarity with current and emerging regulatory legislation, industry trends, and health care business practices globally; Highly developed organizational skills and project management skills with demonstrated strengths in strategic planning, delegation, resource allocation, and workload prioritization; A clear communicator who can influence stakeholders effectively, both internally and externally, with outstanding presentation, written and verbal communication skills; Track record of successful interactions with regulatory and health authorities; You are a connector, building relationships and partnering across the organization to achieve the company goals; You excel in a fast-paced, results-driven, highly accountable environment; You are pragmatic, yet creative and innovative and lead while ""rolling up your sleeves"" to get it done; You show strong leadership with proven ability to build, motivate and develop a team; You resonate with the values of argenx and you are ready to drive the Company Culture; You combine strategic thinking with the ability to execute, both individually and by leading teams (in a matrix environment) to achieve operational excellence in the face of challenging goal."
"Senior Director, Global Pharmacovigilance - Safety Physician","MD or equivalent; Completion of an accredited Residency/ Specialty program and is Board Certified or Eligible; 8 year minimum working in pharmacovigilance and drug safety area as a safety physician with experience as a safety lead; Experience as a safety lead in both early and late stage studies including first-in-human trials; Experience in drug development immunology or neurology therapeutic areas is a plus; Strong knowledge of FDA and EMA regulations (GVP, GCP); Experience as a safety lead in a NDA/BLA submissions in the US and MAA in Europe (including contribution to briefing books, CTD dossier, response to safety LOQ/RFI, label negotiations); Experience in managing safety issues in pre-and post-marketing environment; Proven abilities on handing safety surveillance tasks in clinical trials and chairing safety committee meetings; Experience with mentoring junior safety physicians in a variety of PV activities; Ability to work cross-functionally with an international team across multiple time-zones; Excellent communication skills in speaking and writing English.
Reports To
Sr Dir MSU Team Leader."
Director Oligonucleotide R&D,"PhD degree in chemistry or a related field A minimum of 6 years’ experience leading a team, preferably in research & development A minimum of 8 years’ experience in oligonucleotide chemistry, preferably in process development. Familiar with the applied oligonucleotide synthesis technologies and understanding the direction of next-generation technology development. Excellent written and oral communication skills (English, German is an advantage) Strong communication and organizational skills High level of flexibility, independence and ability to work in a team Detail oriented with the ability to troubleshoot and resolve problems"
"Associate Director, Medical Affairs QA","Education:
Bachelor’s degree in Life Sciences, Nursing, Pharmacy or Medicines required; Master’s degree or other advanced degrees preferred.
Experience:
7 or more years pharmaceutical experience in clinical development and the pharmaceutical industry with involvement in regulated GCP environment required.
Skills and additional Requirements
Profound knowledge of global drug development; Demonstrated experience of successfully supporting projects of high impact; Demonstrated agility in a global/matrix environment; Strong interpersonal skills with demonstrated ability to build collaborative relationships; Strong project management skills; Thorough and extensive knowledge of ICH-GCP including FDA/EU regulations, pharmacovigilance, new drug regulations, other key HA guidance’s and current industry practice; Excellent verbal and written communication skills and computer skills; Excellent problem solving and decision-making skills. Skilled at conflict resolution/negotiation; Capable of working independently as well as part of a cross-functional team demonstrating the ability to influence and create alignment across multiple functional areas; Flexibility to react to changing priorities in a dynamic business environment; Considerable organization awareness (e.g. interrelationship of departments, business priorities), including significant experience working cross-functionally and in global teams across different regions of the world High.

Profound knowledge of global drug development; Demonstrated experience of successfully supporting projects of high impact; Demonstrated agility in a global/matrix environment; Strong interpersonal skills with demonstrated ability to build collaborative relationships; Strong project management skills; Thorough and extensive knowledge of ICH-GCP including FDA/EU regulations, pharmacovigilance, new drug regulations, other key HA guidance’s and current industry practice; Excellent verbal and written communication skills and computer skills; Excellent problem solving and decision-making skills. Skilled at conflict resolution/negotiation; Capable of working independently as well as part of a cross-functional team demonstrating the ability to influence and create alignment across multiple functional areas; Flexibility to react to changing priorities in a dynamic business environment; Considerable organization awareness (e.g. interrelationship of departments, business priorities), including significant experience working cross-functionally and in global teams across different regions of the world High."
Manager Regulatory Affairs,"University degree (HBO, Bachelor or Master) in engineering, medical affairs, or life sciences related studies; At least 5 years in a similar leadership role; Experience in Medical Devices; Excellent knowledge of major medical device standards and regulations; Excellent oral and written communication skills in English; Excellent reporting and presentation skills."
Senior Clinical Project Manager,"Relevant experience of pharmaceutical drug development:
Minimum of 5-7 years working in clinical research with management of clinical activities for the set up and running of global registrational studies, for at least 3 years. For Sr. CPM role needs to have experience managing global clinical studies for at least 5-7 yrs; Experience in leading global cross-functional clinical study teams; Experience in managing and developing relationships with Contract Research Organizations (CROs/SPs); Strong understanding of FDA, EMEA and ICH GCP guidelines to ensure the appropriate conduct of clinical studies; Experience in working with multidisciplinary groups (internal & external), flexibility, adaptability and ability skills to work within a matrix environment; Experience across multiple therapeutic areas and managing complex Ph1-3 trials; Experience in outlining clinical study operational strategies and managing de-centralized studies.
Qualification:
Life science or medical graduate or other relevant qualifications.
Language:
English: Very good English language knowledge (oral and written)."
Senior Scientist Biochemistry and Structural Biology,"To make the most of this role and truly thrive, you should have:
A PhD in biochemistry or structural biology or a closely related discipline with a minimum of 5 years’ work experience in an industrial drug discovery setting; Proven ability to independently design and safely execute wet lab experiments; Experience and proven track record in the development and use of biochemical assays to study different molecular target classes (e.g. ELISA assays, biomarker detection, protein purification, protein-protein or protein-ligand interactions, protein turn over, enzymatic assays, capillary-based immunoassays and automated Western blot analysis); Experience in biophysical and structural biology techniques (e.g. surface plasmon resonance, microscale thermophoresis, spectral shift, differential scanning fluorimetry, dynamic light scattering, calorimetry, x-ray crystallographic analysis, cryo-electron microscopy); Experience with RNA-modulating therapies (e.g. ASO, siRNA) incl. targeted delivery is an advantage; A passion for investigating molecular mechanisms and exploring targets with a good understanding on how targets/pathways can be modulated in pain, neuroscience or adjacent disease areas; Ability to set up novel techniques in a result-oriented manner and challenge the status quo with an open mind; Pragmatic, optimistic, problem-solving attitude with natural curiosity; someone who will reach out proactively, internally and externally, to source alternative solutions; Excellent mathematical skills and data analysis capabilities with a drive for data quality and high-quality documentation; Excellent organizational and communication skills with a high level of team spirit."
"Medical Lead, Innovative Medicines, UKIE","Candidate profile:
Self-motivated and proactive; Works for the benefit of the team and business; High personal accountability and strong sense of purpose; Strategic thinking, solution orientated; Skillful prioritisation with ability to change course at short notice and support team to do the same; Enthusiastic, motivating, supportive to direct reports and matrix team; Passion for the value Medical Affairs can bring to the business and for the science of our products; High personal integrity with a strong motivation to ensure compliant and ethical activities for the business; Inclusive: integrates diversity and differences in skills and outlook to get the best out of their reports and team.
Knowledge and Skills:
Trained in the UK Code of Practice to level of a signatory with deep practical insight in UK compliance; Deep scientific understanding; Matrix team leadership; Excellence in communication and presentation skills; fluent English; Coaching and mentorship skills; Rich insight into the evolving UK health care environment and understanding of the principles of market access; Willingness/ability to travel – (approximately ~15% travel nationally/internationally to attend external congresses, internal conferences and HCP engagement activities); People management experience; Deep Scientific knowledge with expertise in oncology/haemato-oncology.
Qualifications:
Advanced scientific or clinical degree (A registered physician or UK registered pharmacist is preferred). Exceptional candidates with a scientific background, with experience and Code knowledge are welcomed; Substantial Medical Affairs experience, preferably in a large market and preferably in one or all of cardiovascular, immunology and neuroscience, ideally as a final signatory; Significant experience in the review and approval of promotional and non-promotional materials and an excellent understanding of the ABPI and IPHA Codes of Practice; Experience in effective working in a cross-functional and matrix team-structure; Track record in developing strategy, supporting the delivery of UK HTA submissions, medical projects & RWD generation; Experience in product launches; Proven capability for developing strong partnerships with Thought Leaders; Medical Affairs experience in early, mid and late-stage product lifecycle management."
Head Drug Safety and Pharmacovigilance (DS&PV),"Medical, Scientific or equivalent Degree; At least 10 years of experience in all aspects of drug safety and pharmacovigilance (clinical development and post marketing); Expert knowledge of European and US Drug Safety and Pharmacovigilance requirements and strong knowledge in other geographical areas; Expert knowledge of Drug Safety/Pharmacovigilance practices and tools (e.g. Argus Database).
Required Competencies & Skills
Strong leadership skills to represent DS&PV at the company level and communicate key issues and opportunities effectively; Agile and flexible mindset to set priorities and work efficiently within a small company; Excellent planning, organization, and time management skills to meet tight deadlines in a fast-paced environment; Strong verbal and written English communication skills, with attention to detail and a quality-oriented approach; Ability to work independently while being a reliable team player, managing multiple projects in a matrix environment.
For this position, the relevant working/residency permit or Swiss/EU-Citizenship is required."
"VP, Head of Virology Translational Sciences","The ideal candidate will:
Possess extensive expertise in translational science as it relates to drug discovery, development, and biomarker strategies; Demonstrate deep knowledge and expertise in complex data mining, data analysis, and visualization; Show a strong ability to leverage diverse data sets for hypothesis testing and generating novel insights; Exhibit a proven ability to quickly adapt to new therapeutic areas and emerging research trends; Be an excellent communicator, both written and verbal, with a proactive, solution-oriented mindset; Thrive within a highly matrixed organizational structure, collaborating effectively with senior executives and cross-functional project teams; Have experience in leading and managing scientific teams, fostering a collaborative and inclusive work environment.
Preferred Qualifications:
Recognized global expertise in one or more viral diseases, preferably HBV; A strong record of scientific publications in peer-reviewed journals; Experience establishing collaborations with key opinion leaders and external research partners.
Experience and Education:
PhD or MD in a relevant scientific discipline (e.g., Virology, Immunology, Systems Biology, Cell/Molecular Biology, or Genetics) with a focus on translational science and biomarker development; 10+ years of demonstrated leadership experience in the pharmaceutical or biotechnology industry, with a strong focus on infectious diseases, preferably hepatitis viruses; Scientific expertise in translational research and biomarkers, demonstrated through publications and contributions to the field; Experience supporting regulatory submissions and working with health authorities.

PhD or MD in a relevant scientific discipline (e.g., Virology, Immunology, Systems Biology, Cell/Molecular Biology, or Genetics) with a focus on translational science and biomarker development; 10+ years of demonstrated leadership experience in the pharmaceutical or biotechnology industry, with a strong focus on infectious diseases, preferably hepatitis viruses; Scientific expertise in translational research and biomarkers, demonstrated through publications and contributions to the field; Experience supporting regulatory submissions and working with health authorities."
"Senior Scientist, Molecular Assay Development","Degree/PhD education with 4+ years relevant work experience in molecular microbiology or infectious disease within the diagnostics field, either in IVD companies or in a clinical laboratory developing multiplex Lab Developed Tests (LDT) or other IVD development context; Experience of quantitative PCR (qPCR) assay design; IVD development and verification; Experience leading or working with teams across multiple projects and organizing own and others’ work to deliver studies/ small projects to meet quality, budget and timeline requirements. Planning experience with resourcing tools would be highly desirable; Natural ability for conducting Root Cause Investigations utilizing Design of Experiments and applying the Scientific Method; Ability to resolve complex technical challenges in line with clinical diagnostic assay requirements, while adhering to published regulatory standards and guidance. Fully conversant of working in a regulated environment with quality systems and knowledge of ISO Quality standards (ISO 13485, 21CFR820, IVDR, ISO 15189, UK MDR, etc.); Fluent in English written and spoken, with the ability to prepare high quality reports and tailor communication to different audiences.
Highly desirable
Experience of different clinical sample types and the challenges they bring to diagnostic assay development; Experience of primer design in a diagnostic assay context; Hands-on experience of microbial culture techniques; Experience of digital PCR (dPCR); Strong in Statistics."
"Director, Head Quality Control","Ideally possess an MSc or PhD in natural sciences (chemical, pharmaceutical subject areas are advantageous); Proven leadership experience in managing leaders; In-depth understanding of Quality Control principles and practices; Proficiency in English is mandatory; Strong customer service and collaboration mindset; Strong communicator with the ability to present needs and strategic concepts clearly, backed by facts and figures; Embrace change and challenge the status quo with a passion for continuous improvement."
"Associate Manager, Regulatory Affairs - Europe (Rare Diseases)","Bachelor’s degree in a relevant discipline and a minimum of 2-4 years of progressively responsible Regulatory Affairs experience in a pharmaceutical, biotechnology, contract research organization (CRO) or related environment with a preference for at least 1 year of successful experience in a European Regulatory Affairs role; Prior experience helping to build a regional Regulatory Affairs function for a growing organization; In-depth knowledge of relevant, regional regulatory guidelines and requirements; Demonstrated, hands-on experience managing and preparing all phases of regional/country- specific regulatory submissions including knowledge of registration procedures in Europe, Switzerland and UK, and in particular with the centralized procedure; Demonstrated track record of success building relationships with, and influencing, regional and/or national health authorities, particularly in situations requiring direct interaction/negotiation; Demonstrated success gaining regional regulatory approval and in providing regulatory support for post-marketing and life cycle management activities such as variations, renewals and labelling, as well as for development activities, such as clinical trial applications."
Clinical Pharmacology Director,"Education/Certifications
Minimum requirements/Education (minimum/desirable):
Desirable: PhD in pharmaceutical sciences/clinical Pharmacology or PharmD, with at least 8 years of industry experience in Clinical Pharmacology, preferably in oncology and rare disease; Minimum: PhD in pharmaceutical sciences/clinical pharmacology or other relevant life sciences, or PharmD with at least 8 years of experience in clinical pharmacology, pharmacokinetics, drug development in an industrial setting; An equivalent combination of relevant education and applicable job experience may be considered.
Experience
Strong analytical and problem-solving skills; Excellent scientific written, interpersonal communication and networking skills with the ability to build cross functional bridges; The ability to work with attention to detail in a time sensitive environment; Strong familiarity with good clinical/laboratory practices (GxPs); Experience working with CROs.
Languages
English: Business level, oral and written.
Key Technical Competencies Required
Knowledge & understanding of drug development processes (SM, PEP, BIOLOGICS, ...); Understanding of needs and constraints in delivering Clinical Pharmacology activities for a clinical study; Ability to analyze Clinical Pharmacology data in the setting of clinical studies and in respect of GCP; Ability to perform PK analysis with dedicated software (Phoenix WinNonLin, SAS, R, …); Ability to write and/or contribute to the drafting/preparation of regulatory documents (IB, clinical trial protocol, CTA modules, submission modules); Strong people skills with the ability to communicate/interact at all levels within the business and with external partners; Strong diagnostic, analytical and process improvement skills; Organisational strategic awareness and proven ability of developing strategic solutions; Strong leadership and line management capability and experience; Excellent IT and Microsoft Office skills; Strong attention to detail, excellent and direct communication skills, strong interpersonal skills, and cross-cultural understanding and sensitivity; Managerial capability with strong leadership profile; Ability to see the big picture, while keeping an eye on the detail; Ability to represent the company in a highly professional manner; Ability to take initiative with a positive attitude in all circumstances; Flexible; independent problem solving and self-direction; Eager and interested in learning and growing."
"Medical Advisor, Medical Affairs and Evidence Generation (MAEG), Partner Markets","Master’s degree, Ph.D., or equivalent in a relevant scientific discipline. MD or PharmD is an advantage; Demonstrated 5-7+ years’ experience in the biotech or pharmaceutical industry in Medical Affairs with a proven successful track record; Multi-country experience is required; previous experience with external collaboration Partners/Companies is an advantage; Scientific and/or clinical experience in neurology and/or rare diseases is strongly preferred; Experience working across multiple therapeutic areas/products; Fluency in English, additional language a plus, preferably Arabic.
OTHER
Has the ability for travel as required (up to 30%)."
Senior Manager Formulation Technology,"Ph.D. (biochemistry, chemistry, pharmaceutics, engineering, or related disciplines) or master’s degree with equivalent work experience to doctoral degree within pharmaceutical/biotechnology sciences; Several years of experience in international pharmaceutical/biotechnology industry, especially in the field of lyophilization and nanoparticular systems (e.g. LNPs); Experience in working with CMOs preferred; Excellent communication skills, team work and intercultural competence; Good knowledge of DoE; Good knowledge of the regulatory requirements; German language would be preferred."
Director Global Oncology Medical Affairs - Clinical Trial Management,"A Master’s degree in the Life Sciences is required. PhD or PharmD is of advantage; ≥ 8 years strong GxP related, clinical operations experience in a pharmaceutical company, and/or Contract Research Organization (CRO). Experience in global clinical study settings and in Medical Affairs settings required. Experience in oncology desired; Experience in non-interventional studies and in medical affairs research projects in a Medical Affairs environment is highly desired and preferred; Demonstrated strong accomplishment in all aspects of conducting global clinical trials; Demonstrates extensive knowledge of design and phases of clinical studies on a global scale, global regulatory requirements, CRO operations and oversight, as well as compliance practices; Effectively oversee and manage CROs and builds strong relationships at the senior levels within the CRO organization; Sound understanding of all Medical Affairs structures and functions relevant for clinical interactions and activities on a global level; Supports and effectively multi-tasks different and complex global assignments and responsibilities; Strong management, interpersonal, prioritization, and problem-solving skills as well as excellent oral and written communication skills; Able to work highly structured and think strategically and anticipate broader impact of decisions on work processes; Understands, identifies, mitigates, and communicates risks at the study and the program level; Effectively leads and influences within the project management matrix at the study and program level; manages functional or direct reports; Sound understanding of the concepts and applications of clinical research, medical affairs terminology, and other disciplines involved in clinical research; Proven ability to work with minor supervision, self-responsible in a cross-functional, global matrix environment; Proficiency in computer applications such as Microsoft Word, Excel, PowerPoint, and Project as well as other relevant platforms related to clinical operations; Fluent English (oral and written)."
